{
  "schemaVersion": "1.0",
  "id": "14-dispute-thread",
  "source": "14-dispute-thread.msg",
  "verified": null,
  "notes": "Synthetic sample. Collections inquiry thread - discussion about payments, not a remittance. The payer and the collections team discuss past-due PROs and where to apply an unapplied amount. PROs and amounts appear, but nothing is being remitted.",
  "expected": {
    "status": "ReviewRequired",
    "metadata": {
      "payerName": "Lucerne Publishing"
    },
    "issues": [
      "payer:remittance_inquiry_thread"
    ]
  }
}
